Publish time,Description,Follows,Reach,Likes,Media URL,Permalink,Conversion
2024-03-08T14:28:27+0000,"Announcing our outstanding cast of #Othello 🍓 Give them some love in the comments!!
At long last, Hamlet Isn't Dead is tackling this famous tale with the incredible guidance of director and #HIDiot @christopherreedbrown 
Coming soon to our home at @centeratwestpark - Tickets will go on sale next week! #StayTuned

#HamletIsntDead #HID #Hidiots #Shakespeare #ComingSoon #NYCTheatre #NYCShakespeare",12.0,1700,189.0,https://scontent-lga3-3.cdninstagram.com/v/t51.29350-15/432240444_768151831660033_7620805970792660772_n.heic?stp=dst-jpg_e35_tt6&_nc_cat=110&ccb=1-7&_nc_sid=18de74&efg=eyJlZmdfdGFnIjoiRkVFRC5iZXN0X2ltYWdlX3VybGdlbi5DMyJ9&_nc_ohc=HB3I8R2yj3QQ7kNvwGOTlsz&_nc_oc=AdkSEKGITd7AHy_d_z_Wo9sWbKLUMd7Esjy7V4L1bzLPu7ZjLl0oxLaDMQYNVzDC8s_6_t65PjnK-GUkuGRcJyJD&_nc_zt=23&_nc_ht=scontent-lga3-3.cdninstagram.com&edm=AM6HXa8EAAAA&_nc_gid=NMh7la5AfM9mywX1Im3YVQ&oh=00_AfdNlpu7oASU4bW9OCAiAmDa7znEB0cB55p3vvW1YbsTqQ&oe=68FEEE69,https://www.instagram.com/p/C4QbIPAO_uG/,0.007058823529411765
2025-02-07T16:57:12+0000,"Kicking off our For Bard’s Sake series with #TwoGents 🐶 featuring some of the Bard’s finest: crossdressing, clownery, and a bit with a dog! Don't miss the shenanigans as four funny folks try to fix this problem play for good. Meet the cast, then snag your tix at the link in our bio! 

#NoHateSpeare #ForBardsSake #Shakespeare #HamletIsntDead #NYCActor #Hidiots #TheatreKid",9.0,1803,79.0,https://scontent-lga3-3.cdninstagram.com/v/t51.29350-15/476582297_2293909164299293_5248111809039082974_n.heic?stp=dst-jpg_e35_tt6&_nc_cat=106&ccb=1-7&_nc_sid=18de74&efg=eyJlZmdfdGFnIjoiRkVFRC5iZXN0X2ltYWdlX3VybGdlbi5DMyJ9&_nc_ohc=7Z5piP_50yYQ7kNvwEQgJ4b&_nc_oc=AdmRD27lg4WSC_MWqypzbCTnkBJozzBxop5vTEsbmkETN8Rtlw-b_S3JUJohXIu5-bTB2IDTFApWclsfpQiUaLz4&_nc_zt=23&_nc_ht=scontent-lga3-3.cdninstagram.com&edm=AM6HXa8EAAAA&_nc_gid=UX7N9kGiqNNdGFe8DDb9yQ&oh=00_Afc_XFsva5f7IPdKPRa2VG7NG5h37g59pWCF2E6iW3ssbA&oe=68FEF8A8,https://www.instagram.com/p/DFx3PvRus8U/,0.004991680532445923
2024-04-01T13:46:39+0000,"How was Othello cast in productions since its first performance? Hint: It wasn’t always…great. But it sure is interesting! Read on, then head to the link in our bio to snag tickets to see our perfect cast.

Text available in comments for screen readers.

#Othello #Shakespeare #History #HamletIsntDead #HID #Hidiots #ClassicalTheatre #NYCShakespeare #TheatreHistory #HistoryLesson",2.0,522,51.0,https://scontent-lga3-3.cdninstagram.com/v/t51.29350-15/434950804_425150820067462_1856735072417731630_n.heic?stp=dst-jpg_e35_tt6&_nc_cat=110&ccb=1-7&_nc_sid=18de74&efg=eyJlZmdfdGFnIjoiQ0FST1VTRUxfSVRFTS5iZXN0X2ltYWdlX3VybGdlbi5DMyJ9&_nc_ohc=sSt9mle0aA0Q7kNvwHwc-bw&_nc_oc=AdmQD0BricOmp_0wCsM33Czvj6TaAgnW19XUhYX1_Jvb6B3DPKL0Cb89P0PqMh3_8OFmIBjC4RTVYLX0lzNyHl_X&_nc_zt=23&_nc_ht=scontent-lga3-3.cdninstagram.com&edm=AM6HXa8EAAAA&_nc_gid=UX7N9kGiqNNdGFe8DDb9yQ&oh=00_AffQcDfPZVo92qP2jSLWofLgUeiHB7MU28KDjulH0uJuhQ&oe=68FEF9AF,https://www.instagram.com/p/C5OJbGvOitS/,0.0038314176245210726
2025-06-01T16:05:57+0000,"Our final show takes flight in two hours 😢 Online or at-the-door tickets are still available!

Gorgeous photos by Giancarlo Osaben @osabenkenobi

#Cymbeline #Shakespeare #HamletIsntDead #Hidiots #NYCShakespeare #TheatreKid #ClosingShow #OffBroadway #OffOffBroadway",1.0,309,34.0,https://scontent-lga3-1.cdninstagram.com/v/t51.29350-15/502944752_1796413250924033_5760283920086576475_n.heic?stp=dst-jpg_e35_tt6&_nc_cat=103&ccb=1-7&_nc_sid=18de74&efg=eyJlZmdfdGFnIjoiQ0FST1VTRUxfSVRFTS5iZXN0X2ltYWdlX3VybGdlbi5DMyJ9&_nc_ohc=vHbz9GPLtBYQ7kNvwEvdP6R&_nc_oc=Adld4_XkeyeLISupNUcRgvI6l_TJtrFDN6rPbvlbboIYuu7srFQjBTqDiapn0b87WOHNx6E6uIQMEbOgpScJGXSN&_nc_zt=23&_nc_ht=scontent-lga3-1.cdninstagram.com&edm=AM6HXa8EAAAA&_nc_gid=UX7N9kGiqNNdGFe8DDb9yQ&oh=00_AfdYtGiWvxWvmTIX_fvj9JPX-yTDMUSeDOaqEwdc3AYkaQ&oe=68FEFA62,https://www.instagram.com/p/DKXUAH8u74H/,0.003236245954692557
2025-04-18T13:00:37+0000,"Get ready for the whirlwind of music, magic, and memes that is #Cymbeline ✨️ 

Shakespeare gets weird with this one, so we will too! Embrace the absurd with us as we test our heroes' agency against the forces of fate #ThanksJupiter 🦅 

Save the dates! Ticket link coming soon, should Jupiter smile upon us. 

Poster design by the incomparable Kailee McDade. Check out their work at kaileemcdade.com 🎨 

#HamletIsntDead #Hidiots #Shakespeare #NYCShakespeare #TheatreKid #ClassicalActor #Memes",5.0,1943,86.0,https://scontent-lga3-1.cdninstagram.com/v/t51.29350-15/490381648_1133452665218779_5665501410942978568_n.heic?stp=dst-jpg_e35_tt6&_nc_cat=108&ccb=1-7&_nc_sid=18de74&efg=eyJlZmdfdGFnIjoiRkVFRC5iZXN0X2ltYWdlX3VybGdlbi5DMyJ9&_nc_ohc=-4QitkobUQkQ7kNvwFeq411&_nc_oc=AdksULVbxte2WoMF_fPu16OK6Z-gT45Zus_jTB6HlrmhPopSZJFl3psBNK7T6bKz8PLGmoUhvf62Qd6JJbju0b7w&_nc_zt=23&_nc_ht=scontent-lga3-1.cdninstagram.com&edm=AM6HXa8EAAAA&_nc_gid=UX7N9kGiqNNdGFe8DDb9yQ&oh=00_AffAC5uGiRontLYioHcOL1XRYBZFjn5EfPGGOOKGJgRYnA&oe=68FF1628,https://www.instagram.com/p/DIlrwWpvosF/,0.0025733401955738548
2025-05-20T15:10:57+0000,"We have officially loaded into St. Luke’s Theatre! We cannot wait to bring this show to audiences in just two days!!

Featuring: our fearless director, stage manager, and producers! 

Support indie theatre and the talented artists bringing this story to life. Tickets available in our bio! #ThanksJupiter

#Cymbeline #Shakespeare #HamletIsntDead #Hidiots #NYCTheatre #NYCShakespeare",2.0,782,62.0,https://scontent-lga3-2.cdninstagram.com/v/t51.75761-15/499610144_18507339841017986_2826411800202103993_n.jpg?stp=dst-jpg_e35_tt6&_nc_cat=105&ccb=1-7&_nc_sid=18de74&efg=eyJlZmdfdGFnIjoiRkVFRC5iZXN0X2ltYWdlX3VybGdlbi5DMyJ9&_nc_ohc=OoQ5geRHPhQQ7kNvwFJSM7A&_nc_oc=AdnJg_j9fgH_CLSpHhacfHkT-nmyC-u-TFd9rTR23d-eWnZMSgigpfd_I8coBDBy3xRXCXDVs2fEjTu3rbgWWNzC&_nc_zt=23&_nc_ht=scontent-lga3-2.cdninstagram.com&edm=AM6HXa8EAAAA&_nc_gid=UX7N9kGiqNNdGFe8DDb9yQ&oh=00_AfdFyujh2QGUnxiQ5Nymjqxn4ms6LOr7yLl8GQOPyTSEyw&oe=68FF03F4,https://www.instagram.com/p/DJ4UK2qu4ed/,0.0025575447570332483
2024-10-09T14:35:35+0000,"Pericles is an epic tale of evil queens, kindhearted strangers, and star-crossed lovers. Of soldiers, poets, and kings! Meet this cast of characters and get your tickets at the link in our bio to see them live - opening next week! ⛵️

#Pericles #HamletIsntDead #Hidiots #NoBoysAllowed #Shakespeare #ClassicalActor",3.0,1220,65.0,https://scontent-lga3-3.cdninstagram.com/v/t51.29350-15/462448332_1263598168161753_6290103634804239614_n.heic?stp=dst-jpg_e35_tt6&_nc_cat=110&ccb=1-7&_nc_sid=18de74&efg=eyJlZmdfdGFnIjoiQ0FST1VTRUxfSVRFTS5iZXN0X2ltYWdlX3VybGdlbi5DMyJ9&_nc_ohc=6xrewRtmLkAQ7kNvwGBTGRR&_nc_oc=AdmiZV9C01rlMpYuTkNMgZSBSz0UxX_I6DRF6ZVKxlYksFBoD0w0DJoDBlC4Yxw4dk9ONlUPD3hcAh1N0HIdXBa-&_nc_zt=23&_nc_ht=scontent-lga3-3.cdninstagram.com&edm=AM6HXa8EAAAA&_nc_gid=UX7N9kGiqNNdGFe8DDb9yQ&oh=00_AfeEbtUhz6gz8EBJI6-miW1bIkl8K99IBACHz6mO05z3Qw&oe=68FEF3F3,https://www.instagram.com/p/DA6C1X-PN4U/,0.002459016393442623
2024-09-03T12:33:03+0000,"Gorgeous shots of When My Cue Comes at The Little Shakespeare Festival by @lacasadelfrancois 📷
Bid these characters adieu for now, but their cues may come again...

#WhenMyCueComes #HamletIsntDead #Hidiots #Shakespeare #LittleShakespeareFestival #FrigidNewYork",2.0,854,92.0,https://scontent-lga3-3.cdninstagram.com/v/t51.29350-15/457880072_809610587858827_6187316265015629664_n.heic?stp=dst-jpg_e35_tt6&_nc_cat=104&ccb=1-7&_nc_sid=18de74&efg=eyJlZmdfdGFnIjoiQ0FST1VTRUxfSVRFTS5iZXN0X2ltYWdlX3VybGdlbi5DMyJ9&_nc_ohc=Kd6mtIPcZY8Q7kNvwF3I7dQ&_nc_oc=Admk5PCFjZaxLs9IXpJ0MciETx8lNte9ThQ0WmCJERPB77iVRNMlQYLS5n2YCxjHB7lxtc0F8hD5bwvsh_q9K7-c&_nc_zt=23&_nc_ht=scontent-lga3-3.cdninstagram.com&edm=AM6HXa8EAAAA&_nc_gid=UX7N9kGiqNNdGFe8DDb9yQ&oh=00_Afet4yHUq_CPsGWmmEnk9YTlPUzNnK-kDgW3F_wbmliavg&oe=68FF06EB,https://www.instagram.com/p/C_dINsSOpRG/,0.00234192037470726
2025-02-20T12:59:20+0000,"Our final show of our #ForBardsSake series is As YOU Like It! Last but certainly not least, this fiesty feminine romp will round out our @caveatnyc debut! Directed by our very own @jmcicalese and cast with resident actors, you're gonna wanna snag your tickets ASAP- get them in our bio! Is love merely a madness? Find out on March 21st! 💚

#AsYouLikeIt #Shakespeare #HamletIsntDead #Hidiots #NoHateSpeare #NYCShakespeare #TheatreKid #TheSixthAgeShifts #IntoTheWoods",5.0,2222,45.0,https://scontent-lga3-1.cdninstagram.com/v/t51.29350-15/480982447_531899813248415_7789634457855346208_n.heic?stp=dst-jpg_e35_tt6&_nc_cat=102&ccb=1-7&_nc_sid=18de74&efg=eyJlZmdfdGFnIjoiRkVFRC5iZXN0X2ltYWdlX3VybGdlbi5DMyJ9&_nc_ohc=kaJtATnNqXUQ7kNvwGkFXi4&_nc_oc=AdkyazBBfm9iULyUpPCzaXHf4I309aJYKLEqhwzCyueHIuekXSdUdrhPAkwFVh7T4JWs-6hBcNta9bipDadAvQZC&_nc_zt=23&_nc_ht=scontent-lga3-1.cdninstagram.com&edm=AM6HXa8EAAAA&_nc_gid=UX7N9kGiqNNdGFe8DDb9yQ&oh=00_AfeeUDFaRvpq1-8q49GIMA9CyyBscfhPsq_8l9PgpLoTyg&oe=68FF0278,https://www.instagram.com/p/DGS6W-3ug7J/,0.0022502250225022503
2024-09-06T15:30:35+0000,"Look at all of these gorgeous people! They must be incredibly famous and important...oh wait they ARE! Because they're our 2024-25 Resident Acting Company!!! Please give a warm welcome and hearty congratulations to this year's ensemble. We cannot wait to get started 💀

#HamletIsntDead #RacAtItAgain #Hidiots #Shakespeare #NYCShakespeare #ClassicalActor",7.0,3192,187.0,https://scontent-lga3-2.cdninstagram.com/v/t51.29350-15/458490107_1699286980844653_3150828503575553809_n.heic?stp=dst-jpg_e35_tt6&_nc_cat=100&ccb=1-7&_nc_sid=18de74&efg=eyJlZmdfdGFnIjoiRkVFRC5iZXN0X2ltYWdlX3VybGdlbi5DMyJ9&_nc_ohc=-8jrGXcEYxgQ7kNvwFuJsUq&_nc_oc=Adlweg-bF9R3DjltdySt0u8D_TXZHLHxk06IxZtWEOl6nFiq4Q2yQJ5nPIyt_Z5ollWzVQ9JTzchOUuQ6k-Ds68S&_nc_zt=23&_nc_ht=scontent-lga3-2.cdninstagram.com&edm=AM6HXa8EAAAA&_nc_gid=UX7N9kGiqNNdGFe8DDb9yQ&oh=00_Afczz2l2MIN2Bn2LqEmjb-fuDEkytGtS8A4vLH471HxbIA&oe=68FEEF41,https://www.instagram.com/p/C_lK7epPzjr/,0.0021929824561403508
2024-06-25T18:43:14+0000,"Announcing our 2024-25 season! We're continuing through the canon with our 31st and 32nd productions: Pericles and Cymbeline (affectionately referred to by our team as Cymbelmeme). Join us for a high-adventure, drama-filled season with plenty of sea shanties and HIDiocy along the way!

#HamletIsntDead #SeasonAnnouncement #Shakespeare #HID #Hidiots #NYCShakespeare #NYCTheatre #Pericles #Cymbeline #Cymbelmeme",2.0,921,80.0,https://scontent-lga3-2.cdninstagram.com/v/t51.29350-15/449137999_1137438587490654_8569225546428917524_n.heic?stp=dst-jpg_e35_tt6&_nc_cat=100&ccb=1-7&_nc_sid=18de74&efg=eyJlZmdfdGFnIjoiRkVFRC5iZXN0X2ltYWdlX3VybGdlbi5DMyJ9&_nc_ohc=NYVgboCHc5EQ7kNvwE2AhZN&_nc_oc=AdlnYM-OMK6_hARhW7Qig5obXljvd9YqxyYMNUUF4CFCEYZcM7N49O9ZEWPS-qt_ZZsaSBx7qw_4kl3STzYkk815&_nc_zt=23&_nc_ht=scontent-lga3-2.cdninstagram.com&edm=AM6HXa8EAAAA&_nc_gid=UX7N9kGiqNNdGFe8DDb9yQ&oh=00_AfeIyi4iIH0ONEihonqw9f-EeGl3fud-jl_1WAt2XRTs3Q&oe=68FF0A75,https://www.instagram.com/p/C8pi7zZvHHM/,0.002171552660152009
2024-08-26T14:00:15+0000,"We are so excited to share the incredible cast of Pericles directed by HID's Creative Director, @sophia.c.carlin. Show 'em some love in the comments below!! 💕

It’s time to go on an epic adventure. Full of everything in the sea, from feisty fisherman to pesky pirates, the story of #Pericles is one that deserves to be told… from an entirely new perspective. With their joyful and musically vibrant style, #HamletIsntDead takes this story and steers for a different course. Featuring a no boys allowed cast and original music by @sleotacarlin, Pericles asks the question, “what makes a life worth living?”

Ticket details coming soon but #SaveTheDate! This is a show you won't want to miss. 🌊⛵️🌊

#NYCShakespeare #HIDPericles #HIDiocy #NoBoysAllowed #CenterAtWestPark #CastDrop",11.0,5413,196.0,https://scontent-lga3-2.cdninstagram.com/v/t51.29350-15/457150508_516801387654210_4103899933195028767_n.heic?stp=dst-jpg_e35_tt6&_nc_cat=100&ccb=1-7&_nc_sid=18de74&efg=eyJlZmdfdGFnIjoiRkVFRC5iZXN0X2ltYWdlX3VybGdlbi5DMyJ9&_nc_ohc=EwMmAS_yFhwQ7kNvwHnB8Wb&_nc_oc=AdmoPWv_lEtzsKadiEtrWYqyuWle61QIyBTyggFYhj7vPCrH42BE6n7FcBEaD5KPbYskERrf0Eez_JKpu7DKF6TD&_nc_zt=23&_nc_ht=scontent-lga3-2.cdninstagram.com&edm=AM6HXa8EAAAA&_nc_gid=UX7N9kGiqNNdGFe8DDb9yQ&oh=00_Afe6huummQnXxeXbsRfCcYE_DSwQxmHaARDa2i8Q1wlc5w&oe=68FF1081,https://www.instagram.com/p/C_Ir4UdvIH_/,0.002032144836504711
2024-04-05T20:59:57+0000,"It's time for another #MeetAHidiot and you will probably recognize this face! Stephanie has been with Hamlet Isn’t Dead for 7 years, and she is an absolute delight to work with every single time! Don’t miss her in action- get your tickets at the link in our bio before it’s too late! We open in one week, people!!! #Zounds

#ImageDescription in comments

#Hidiots #HamletIsntDead #HID #Shakespeare #Othello #NYCActor #ClassicalActor #ClassicalTheatre #NYCTheatre #NYCShakespeare",1.0,508,36.0,https://scontent-lga3-3.cdninstagram.com/v/t51.29350-15/436333712_1639460103533176_2332424681326552414_n.heic?stp=dst-jpg_e35_tt6&_nc_cat=104&ccb=1-7&_nc_sid=18de74&efg=eyJlZmdfdGFnIjoiQ0FST1VTRUxfSVRFTS5iZXN0X2ltYWdlX3VybGdlbi5DMyJ9&_nc_ohc=gNCRI8uDcrYQ7kNvwEpzv3r&_nc_oc=AdngEnUWrNm-2FhaiH1dWwaWND7wiMn24M73b_a6OR0REGE9UsmeFWErRJxTaTDTF3YUTnhVKpbRbNpj4v-f5XRZ&_nc_zt=23&_nc_ht=scontent-lga3-3.cdninstagram.com&edm=AM6HXa8EAAAA&_nc_gid=UX7N9kGiqNNdGFe8DDb9yQ&oh=00_AfeY69wUNJB3UtddXsebre3PMWHA5HbFqtzIqBBeYsVfhQ&oe=68FEE43F,https://www.instagram.com/p/C5ZOMNIvz8n/,0.001968503937007874
2025-03-28T14:32:09+0000,"Announcing at long last our cast of Cymbeline! We cannot wait for this Resident Acting Company showcase production and to get started with this brilliant ensemble. 

Save the date and head to the link in our bio to help sponsor this production!! #ThanksJupiter 🦅

#HamletIsntDead #Hidiots #Cymbeline #Shakespeare #ClassicalActor #TheatreKid",3.0,1732,95.0,https://scontent-lga3-1.cdninstagram.com/v/t51.29350-15/486659491_1791905891671646_404679877889777837_n.heic?stp=dst-jpg_e35_tt6&_nc_cat=108&ccb=1-7&_nc_sid=18de74&efg=eyJlZmdfdGFnIjoiQ0FST1VTRUxfSVRFTS5iZXN0X2ltYWdlX3VybGdlbi5DMyJ9&_nc_ohc=raMIqjyKwdIQ7kNvwHh7-T_&_nc_oc=AdnQ3DPXKw1VuqhFCaesK88N_A7MiYLA8NysMRs3jHWS1QYqImR3_igZzlwuDdCYI0HAPmthCPCU_VZ4PK3pqjre&_nc_zt=23&_nc_ht=scontent-lga3-1.cdninstagram.com&edm=AM6HXa8EAAAA&_nc_gid=UX7N9kGiqNNdGFe8DDb9yQ&oh=00_AfeImqefOGgowLasukPToRqbRzSsD-QrNs5KEx7rJ1wTZA&oe=68FF05E4,https://www.instagram.com/p/DHvxmRMucJq/,0.0017321016166281756
2025-02-25T13:37:56+0000,"✨️ Exciting News! ✨️
ShakesPreK is BACK and ready to bring the magic of Shakespeare to little ones all over NYC! 🎭
We're bringing fun & educational adventures to classrooms in all five boroughs, and introducing preschoolers to the world of the Bard through play, creativity, and imagination. 📚
Know any teachers or parents who would love ShakesPreK? Send them our way to set up a free demo class! 🎉
Check out the link in our bio for more info!

#ShakesPreK #EarlyChildhoodDevelopment #ShakespeareForKids #LearningThroughPlay",1.0,584,36.0,https://scontent-lga3-2.cdninstagram.com/v/t51.29350-15/481590882_644499028320456_4864148808226999658_n.heic?stp=dst-jpg_e35_tt6&_nc_cat=107&ccb=1-7&_nc_sid=18de74&efg=eyJlZmdfdGFnIjoiRkVFRC5iZXN0X2ltYWdlX3VybGdlbi5DMyJ9&_nc_ohc=6IA0i8bytosQ7kNvwEi27AG&_nc_oc=Adn2C-EnsR9sO4EVlw5Qaozsw-KsmyO7SeThl0dxPaRS_MmYOuQXAG6039Euw8iW2FJtAbfbIOgbe5PyZEeezUFU&_nc_zt=23&_nc_ht=scontent-lga3-2.cdninstagram.com&edm=AM6HXa8EAAAA&_nc_gid=UX7N9kGiqNNdGFe8DDb9yQ&oh=00_Afc4m-gp49_5zPkBZlQgfQbMt3MXZwg39Nw3Hy9CPAth8Q&oe=68FEF440,https://www.instagram.com/p/DGf2wEtJ27R/,0.0017123287671232876
2024-09-26T12:30:48+0000,"Meet some of our stellar cast of Pericles, which opens in three weeks!!! These swashbucklers have been working hard to bring the epic tale of Pericles to life ⛵️ Head to the link in our bio for tickets!
#Pericles #HamletIsntDead #Hidiots #Shakespeare #ClassicalActor #CenterAtWestPark #NoBoysAllowed #NYCShakespeare 

Text reads, ""Cast highlight. Ellie Armitage as Gower and Band. Quote: ""Pericles is an epic about storms and shipwrecks, love and loss, and what makes a life worth living. What's not to love?""
Cast highlight. Romeo Torres as Cleon, Lysimachus, Third Knight, and Second Pirate. Quote: ""The challenge of creating four distinct characters, some with much more text to work through than others-- unreal. The ask at each rehearsal is to be both your most intelligent and most idiotic."" 
Cast highlight. Abril López as Thaisa and Diana. Quote: ""We are really taking sea la vie to a whole new level."" 
Cast highlight. Stefania Gonzalez as Understudy for Pericles and others. Quote: ""In a rehearsal room filled with laughter and play and grief and groundedness, it's easy to find answers to 'Why live a life?'""
The Center at West Park. October 17th through 26th.",2.0,1227,35.0,https://scontent-lga3-2.cdninstagram.com/v/t51.29350-15/461317947_2980098835466093_3036733352659525189_n.heic?stp=dst-jpg_e35_tt6&_nc_cat=100&ccb=1-7&_nc_sid=18de74&efg=eyJlZmdfdGFnIjoiQ0FST1VTRUxfSVRFTS5iZXN0X2ltYWdlX3VybGdlbi5DMyJ9&_nc_ohc=iu336I1Y6gcQ7kNvwHP5L2m&_nc_oc=AdkZ1R-XqUrEHd0Zj-vy6kZa1KiTn84OugZeLkTWFOsiNWeWmj0uVvolkpeXYTaleM2_ZYJL2TWJelqgDaL5y-MX&_nc_zt=23&_nc_ht=scontent-lga3-2.cdninstagram.com&edm=AM6HXa8EAAAA&_nc_gid=UX7N9kGiqNNdGFe8DDb9yQ&oh=00_Afec4MHvBRpIfjPBr9KfHsFBE88aYpoct3CwBNvjNmIs6A&oe=68FEFDA8,https://www.instagram.com/p/DAYWMPzPRlO/,0.0016299918500407497
2024-03-19T14:37:43+0000,"Ok, let’s address the elephant in the room. Othello is a heavy play full of racial prejudice, misogyny, and fetishization. This infographic just scratches the surface of the discussions we’ve had about race in the play so that we can be our joyful, HIDiotic selves…without making racism a joke. Thank you so much to Farah Karim Cooper for her incredible book #TheGreatWhiteBard which we consider essential reading for the modern Shakespeare artist!
#ImageDescription in comments

#Othello #Shakespeare #HamletIsntDead #HID #Hidiots #ClassicalTheatre #NYCShakespeare #NYCTheatre #NYCActor #ClassicalActor #AntiracistTheatre",1.0,638,61.0,https://scontent-lga3-2.cdninstagram.com/v/t51.29350-15/433998207_816285323866536_2058229924481972708_n.heic?stp=dst-jpg_e35_tt6&_nc_cat=105&ccb=1-7&_nc_sid=18de74&efg=eyJlZmdfdGFnIjoiQ0FST1VTRUxfSVRFTS5iZXN0X2ltYWdlX3VybGdlbi5DMyJ9&_nc_ohc=k31IzxMRlJQQ7kNvwFE6O4A&_nc_oc=AdmUlpFHRRpkFFWoz1PYzy3FWLMRs0gLqcwhXHjEoVQ8RQYjz22_HbpZz10GeIFKUyJKkIn8To9GJO_n6zOwvBVb&_nc_zt=23&_nc_ht=scontent-lga3-2.cdninstagram.com&edm=AM6HXa8EAAAA&_nc_gid=UX7N9kGiqNNdGFe8DDb9yQ&oh=00_AfeKS8-uSFG2c02yxkO6leHsmx0lTrib2kPD6YonE0hp3w&oe=68FEF79F,https://www.instagram.com/p/C4sw7z2utpg/,0.001567398119122257
2024-07-16T13:36:26+0000,"In Waiting Room Z, Shakespeare’s most often forgotten characters find themselves antsy, excited, and lost. It is here that the all-knowing Stage Manager sends them out into the world. However, it’s been years since these characters have been in the spotlight, and they’re beginning to grow impatient. Hamlet Isn't Dead's ""When My Cue Comes"" is a devised play that follows four of these “left-behind” characters in the canon and their desperate attempts to do whatever it takes to take their place on stage once again.

Helmed by @b.carty23 and devised and performed by @aaronanthonymoore @reidywatson @ladymaudlin @nataliedeboer.actor and @gabrielcethridge we are thrilled to bring this new production to @frigidnewyork 's Little Shakespeare Festival! See us August 2-17 and get your tickets at the link in our bio today!

#Shakespeare #DevisedTheatre #FrigidNewYork #LittleShakespeareFestival #WhenMyCueComes #NYCActor #Hamlet #Tempest #AsYouLikeIt #Hidiots",2.0,1282,33.0,https://scontent-lga3-2.cdninstagram.com/v/t51.29350-15/451358749_1002601801076853_4263102887627237880_n.heic?stp=dst-jpg_e35_tt6&_nc_cat=107&ccb=1-7&_nc_sid=18de74&efg=eyJlZmdfdGFnIjoiRkVFRC5iZXN0X2ltYWdlX3VybGdlbi5DMyJ9&_nc_ohc=z0f4hZCE_y8Q7kNvwHgH37x&_nc_oc=AdmFUW8RWlj1WwdBT9bOyvlB6nN3MAajfnlJkx31b51J1BS4m6vLuyffcoPZ1GXebrDKAiuIL1ezTN2k4iTaFOHK&_nc_zt=23&_nc_ht=scontent-lga3-2.cdninstagram.com&edm=AM6HXa8EAAAA&_nc_gid=UX7N9kGiqNNdGFe8DDb9yQ&oh=00_AfcyuXB2Z6CgswTngtiPG3RzJAedHzTPa75XaRlNMO4i4A&oe=68FF07B6,https://www.instagram.com/p/C9fEhB6OB0m/,0.0015600624024961
2024-04-12T21:58:06+0000,"Are you ready? Othello opens tonight!! and we couldn't be prouder of this team 💕 Come see this heartbreakingly beautiful story unfold and get ready for an evening full of great music, belly laughs (and maybe a few tears?) 
For two weeks only! Get your tickets at the link in our bio 🍓
Photos by the incomparable @taymcintyr 

#Othello #Shakespeare #OpeningNight #HamletIsntDead #Hidiots",1.0,696,62.0,https://scontent-lga3-1.cdninstagram.com/v/t51.29350-15/438377687_1194709274846225_2251957466175958169_n.heic?stp=dst-jpg_e35_tt6&_nc_cat=108&ccb=1-7&_nc_sid=18de74&efg=eyJlZmdfdGFnIjoiQ0FST1VTRUxfSVRFTS5iZXN0X2ltYWdlX3VybGdlbi5DMyJ9&_nc_ohc=XofAGiV3POYQ7kNvwGnNNXR&_nc_oc=AdkKDaIqekIxrxqHRYSj01JOq-_4GoYfowUTt5_gCx_CdwPga53oWTaykx-dFugF3HGwi4iYJ6dffyVQ0sgWHxh1&_nc_zt=23&_nc_ht=scontent-lga3-1.cdninstagram.com&edm=AM6HXa8EAAAA&_nc_gid=UX7N9kGiqNNdGFe8DDb9yQ&oh=00_AfdlfUHOnGaLDREcrddnSpjUKuAnzqV2FS2erJ3CQaAaYQ&oe=68FEF62C,https://www.instagram.com/p/C5rWaOyvZMm/,0.0014367816091954023
2024-04-18T12:56:54+0000,"It's your last chance to see Hamlet Isn’t Dead’s Othello! We are so proud of this team who beautifully brought this masterpiece to life with joy, curiosity, and care. You do not want to miss this triumph! Snag your tickets at the link in our bio 🎟 Quick- we close Saturday!
Photos by the fabulous @taymcintyr 

#Othello #Shakespeare #HamletIsntDead #HID #Hidiots #ClassicalTheatre #ClassicalActor #NYC #NYCTheatre #NYCActor",1.0,700,64.0,https://scontent-lga3-2.cdninstagram.com/v/t51.29350-15/439282112_1141459103968763_2992148268986172356_n.heic?stp=dst-jpg_e35_tt6&_nc_cat=109&ccb=1-7&_nc_sid=18de74&efg=eyJlZmdfdGFnIjoiQ0FST1VTRUxfSVRFTS5iZXN0X2ltYWdlX3VybGdlbi5DMyJ9&_nc_ohc=k_z84oVkHgUQ7kNvwEadvoL&_nc_oc=AdkWsU5r4g8tNkG2I5Ka86XzLG4oKEQ0QJiasPslubPv79JYF63NwO5bsM7R4t_DoDcZK8HPB1kOPNa6qfSzgt4t&_nc_zt=23&_nc_ht=scontent-lga3-2.cdninstagram.com&edm=AM6HXa8EAAAA&_nc_gid=UX7N9kGiqNNdGFe8DDb9yQ&oh=00_Afe4VazHRI8PPXYeow1Y2E2_odjHxA0weVXVhaNtsHLkyA&oe=68FEE97D,https://www.instagram.com/p/C551PnfOCFK/,0.0014285714285714286
2024-10-16T13:10:57+0000,"Our interpretation of Pericles features an all gender-marginalized cast- aka #NoBoysAllowed But this decision was not made on a whim. Learn more about our vision, and get your tickets at the link in our bio- we open TOMORROW!
#Pericles #HamletIsntDead #Hidiots #Shakespeare

Text reads: Hamlet Isn't Dead's Pericles. Why no boys allowed? Quote from Tina Packer's book, Women of Will: ""It has taken hundreds of years for women’s voices to be heard and affect the course of human events. In order for the world to find its healthy balance, all women’s voices need to be heard."" End quote. Text continues: We have taken that sentiment and included all marginalized genders, not just women, in this reimagining of Pericles. Hamlet Isn't Dead has a long history of non-male interpretations, like in the 2017 production of Henry the fifth, the 2018 production of As You Like It, and the 2019 production of Troilus and Cressida. Quote from Olivia Basile, who plays Pericles, ""When you're someone in a body or a gender that is marginalized, you're never thinking Pericles is you. The rehearsal process has been a really safe space to engage with a text that I don't think I'd engage with otherwise."" End quote. Quote from Jillian Cicalese, Assistant Director, ""We’re exploring a story that is traditionally told with cis men using a better representation of today's artists and discovering how the text translates through those voices. To me, this piece is about finding power in femininity and the relationship between daughter and father. The feminine spirit through the character of Marina brings her father back to life after years of estrangement, trials, and tribulations."" End quote. Quote from Sophia Carlin, Director, “The things that happen to Pericles, the loss of his wife, child, and general uncertainty of where to call home, can happen to anyone. Because we have a focus on centering marginalized voices in this production, their perspectives on these characters are upheld above anything else. My hope is that this process has become a very safe space but also a very soft space in that it is informed by the experiences and needs of the people we've chosen to collaborate with.” End Quote.",3.0,2130,93.0,https://scontent-lga3-3.cdninstagram.com/v/t51.29350-15/463369246_557178133658299_385240364412777647_n.heic?stp=dst-jpg_e35_tt6&_nc_cat=110&ccb=1-7&_nc_sid=18de74&efg=eyJlZmdfdGFnIjoiQ0FST1VTRUxfSVRFTS5iZXN0X2ltYWdlX3VybGdlbi5DMyJ9&_nc_ohc=SAzGuZybLWYQ7kNvwEmGM_u&_nc_oc=Adn3K8ZC-G9F6d7jYVI1cubSN_8413ltLolqcz674PFIrOxCh0zEHJ1m6EgQx_pFuDDQzp_RIjNTMO0en-U46iTK&_nc_zt=23&_nc_ht=scontent-lga3-3.cdninstagram.com&edm=AM6HXa8EAAAA&_nc_gid=UX7N9kGiqNNdGFe8DDb9yQ&oh=00_AfcSN5FFLQXyDl3MREnrZ_W0DA4cgx4a8aiPgoKz88UGrw&oe=68FF0D88,https://www.instagram.com/p/DBL6rhovFvu/,0.0014084507042253522
